{
  "id": "verification-2026-09-16-v1",
  "run_at": "2026-09-23T10:00:00+08:00",
  "providers_checked": 5,
  "products_checked": 21,
  "price_records_checked": 39,
  "price_changes": 0,
  "notes": "Backfilled 23 Sep 2026. No live checkout was run that calendar day. Official Hostinger, DigitalOcean, Vultr, Kinsta, and WP Engine USD amounts on 14 Sep and 23 Sep were identical, so this snapshot records the intervening day at those unchanged amounts. WP Engine list remains Startup $35 / Professional $65; first-year coupon is not stored as list. Kinsta Single 20GB first-month-free promo remains $0."
}
