{
  "id": "verification-2026-09-23-v1",
  "run_at": "2026-09-23T10:05:00+08:00",
  "providers_checked": 5,
  "products_checked": 21,
  "price_records_checked": 39,
  "price_changes": 0,
  "notes": "Daily price verification. Hostinger VPS/Managed WordPress, DigitalOcean Basic Droplets, Kinsta, Vultr High Performance, and WP Engine USD amounts unchanged versus 2026-09-14. 15-22 Sep were backfilled the same day because 14 Sep and 23 Sep official amounts were identical; those days had no live checkout. 11 Sep, 12 Sep, and 29 Aug remain empty. Vultr monthly caps from api.vultr.com/v2/plans; public pricing HTML remains Cloudflare-blocked so displayed hourly rates remain $0.009/$0.036/$0.071/$0.143. Kinsta Single 20GB first-month-free promo still present. WP Engine list remains Startup $35 / Professional $65 from official /plans configurator annual base_price ($420/$780) with wpe_currency=USD; first-year coupon $28/$52 per month is not stored as list."
}
